{
  "schemaVersion": 1,
  "skillId": "planning-agent",
  "slots": {
    "primary_provider_name": "configured primary provider",
    "project_name_lower": "aidrian harness producer",
    "repository_slug": "aidrian-harness",
    "runtime_state_root": ".agent-harness",
    "tracker_team_key": "HARNESS"
  },
  "resources": {}
}
